{
  "$schema": "https://raw.githubusercontent.com/davidsteimer/fristenrechner/main/schemas/special-regime-catalog-v2.schema.json",
  "formatVersion": "2.0.0",
  "dataKind": "specialRegimeCatalog",
  "catalogId": "vrpg-be-special-regimes-2026-08-30",
  "profileId": "vrpg-be",
  "jurisdiction": {
    "level": "cantonal",
    "code": "BE"
  },
  "validity": {
    "dataValidFrom": "2026-08-30",
    "dataValidTo": null
  },
  "review": {
    "reviewedOn": "2026-08-30",
    "status": "verified",
    "reviewedBy": "David Steimer",
    "basis": "AP11A fachlich abgenommen. In AP11B gemäss DEC-2026-014 in berechnete und behördlich gesetzte Fristen getrennt."
  },
  "scope": {
    "de": "Bekannte und praktisch relevante Spezialregime zum bernischen VRPG mit Schwerpunkt politische Rechte sowie unmittelbar relevante bundesrechtliche Weiterzüge.",
    "fr": "Régimes spéciaux connus et pertinents en pratique par rapport à la LPJA bernoise, avec un accent sur les droits politiques et les recours fédéraux directement pertinents."
  },
  "sources": [
    {
      "sourceId": "SRC-VRPG-BE-20230801",
      "sourceType": "statute",
      "title": "Gesetz über die Verwaltungsrechtspflege, BSG 155.21",
      "authority": "Kanton Bern",
      "url": "https://www.belex.sites.be.ch/app/de/texts_of_law/155.21",
      "documentVersionDate": "2023-08-01",
      "reviewedOn": "2026-08-30",
      "reviewStatus": "verified"
    },
    {
      "sourceId": "SRC-PRG-BE-CURRENT",
      "sourceType": "statute",
      "title": "Gesetz über die politischen Rechte, BSG 141.1",
      "authority": "Kanton Bern",
      "url": "https://www.belex.sites.be.ch/app/de/texts_of_law/141.1",
      "documentVersionDate": null,
      "reviewedOn": "2026-08-30",
      "reviewStatus": "verified"
    },
    {
      "sourceId": "SRC-PRV-BE-CURRENT",
      "sourceType": "ordinance",
      "title": "Verordnung über die politischen Rechte, BSG 141.112",
      "authority": "Kanton Bern",
      "url": "https://www.belex.sites.be.ch/app/de/texts_of_law/141.112",
      "documentVersionDate": null,
      "reviewedOn": "2026-08-30",
      "reviewStatus": "verified"
    },
    {
      "sourceId": "SRC-BPR-20221023",
      "sourceType": "statute",
      "title": "Bundesgesetz über die politischen Rechte, SR 161.1",
      "authority": "Schweizerische Eidgenossenschaft",
      "url": "https://www.fedlex.admin.ch/eli/cc/1978/688_688_688/de",
      "documentVersionDate": "2022-10-23",
      "reviewedOn": "2026-08-30",
      "reviewStatus": "verified"
    },
    {
      "sourceId": "SRC-VPR-20220701",
      "sourceType": "ordinance",
      "title": "Verordnung über die politischen Rechte, SR 161.11",
      "authority": "Schweizerische Eidgenossenschaft",
      "url": "https://www.fedlex.admin.ch/eli/cc/1978/712_712_712/de",
      "documentVersionDate": "2022-07-01",
      "reviewedOn": "2026-08-30",
      "reviewStatus": "verified"
    },
    {
      "sourceId": "SRC-BGG-20260401",
      "sourceType": "statute",
      "title": "Bundesgerichtsgesetz, SR 173.110",
      "authority": "Schweizerische Eidgenossenschaft",
      "url": "https://www.fedlex.admin.ch/eli/cc/2006/218/de",
      "documentVersionDate": "2026-04-01",
      "reviewedOn": "2026-08-30",
      "reviewStatus": "verified"
    },
    {
      "sourceId": "SRC-ATSG-20240101",
      "sourceType": "statute",
      "title": "Allgemeiner Teil des Sozialversicherungsrechts, SR 830.1",
      "authority": "Schweizerische Eidgenossenschaft",
      "url": "https://www.fedlex.admin.ch/eli/cc/2002/510/de",
      "documentVersionDate": "2024-01-01",
      "reviewedOn": "2026-08-30",
      "reviewStatus": "verified"
    },
    {
      "sourceId": "SRC-VWVG-20220701",
      "sourceType": "statute",
      "title": "Verwaltungsverfahrensgesetz, SR 172.021",
      "authority": "Schweizerische Eidgenossenschaft",
      "url": "https://www.fedlex.admin.ch/eli/cc/1969/737_757_755/de",
      "documentVersionDate": "2022-07-01",
      "reviewedOn": "2026-08-30",
      "reviewStatus": "verified"
    },
    {
      "sourceId": "JUD-BGER-9C-757-2007",
      "sourceType": "caseLaw",
      "title": "BGer 9C_757/2007 vom 3. Januar 2008",
      "authority": "Bundesgericht",
      "url": "https://mcp.opencaselaw.ch/entscheid/bger_9C_757_2007#e-3",
      "documentVersionDate": "2008-01-03",
      "reviewedOn": "2026-08-30",
      "reviewStatus": "verified"
    },
    {
      "sourceId": "JUD-BGER-8C-620-2007",
      "sourceType": "caseLaw",
      "title": "BGer 8C_620/2007 vom 9. Juni 2008",
      "authority": "Bundesgericht",
      "url": "https://mcp.opencaselaw.ch/entscheid/bger_8C_620_2007#e-3-3",
      "documentVersionDate": "2008-06-09",
      "reviewedOn": "2026-08-30",
      "reviewStatus": "verified"
    },
    {
      "sourceId": "JUD-BE-VG-100-2016-347",
      "sourceType": "caseLaw",
      "title": "VGer BE 100.2016.347U vom 29. Juni 2017, BVR 2017 S. 459",
      "authority": "Verwaltungsgericht des Kantons Bern",
      "url": "https://entscheidsuche.ch/docs/BE_Verwaltungsgericht/BE_VG_001_100-2016-347_2017-06-29.pdf",
      "documentVersionDate": "2017-06-29",
      "reviewedOn": "2026-08-30",
      "reviewStatus": "verified"
    },
    {
      "sourceId": "JUD-BE-VG-100-2017-270",
      "sourceType": "caseLaw",
      "title": "VGer BE 100.2017.270 vom 12. Dezember 2017",
      "authority": "Verwaltungsgericht des Kantons Bern",
      "url": "https://entscheidsuche.ch/docs/BE_Verwaltungsgericht/BE_VG_001_100-2017-270_2017-12-12.pdf",
      "documentVersionDate": "2017-12-12",
      "reviewedOn": "2026-08-30",
      "reviewStatus": "verified"
    },
    {
      "sourceId": "JUD-BE-VG-100-2021-189",
      "sourceType": "caseLaw",
      "title": "VGer BE 100.2021.189U vom 22. Oktober 2021, BVR 2022 S. 5",
      "authority": "Verwaltungsgericht des Kantons Bern",
      "url": "https://mcp.opencaselaw.ch/entscheid/be_verwaltungsgericht_100_2021_189",
      "documentVersionDate": "2021-10-22",
      "reviewedOn": "2026-08-30",
      "reviewStatus": "verified"
    },
    {
      "sourceId": "JUD-BGER-1C-275-2009",
      "sourceType": "caseLaw",
      "title": "BGer 1C_275/2009 vom 1. Oktober 2009",
      "authority": "Bundesgericht",
      "url": "https://mcp.opencaselaw.ch/entscheid/bger_1C_275_2009#e-3-3-2",
      "documentVersionDate": "2009-10-01",
      "reviewedOn": "2026-08-30",
      "reviewStatus": "verified"
    },
    {
      "sourceId": "SRC-PRG-MATERIALS-2018",
      "sourceType": "officialDossier",
      "title": "Vortrag des Regierungsrates zur PRG-Revision 2018",
      "authority": "Regierungsrat des Kantons Bern",
      "url": "https://www.rrgr-service.apps.be.ch/api/rr/documents/document/b784c1f0933d4f629bc0fed1a4cd78ae-332/6/2016.STA.10699-vortrag-04.04.2018-de.pdf",
      "documentVersionDate": "2018-04-04",
      "reviewedOn": "2026-08-30",
      "reviewStatus": "verified"
    },
    {
      "sourceId": "SRC-RRB-498-2024",
      "sourceType": "officialDossier",
      "title": "RRB Nr. 498/2024, Regierungsstatthalter-Ersatzwahl Emmental",
      "authority": "Regierungsrat des Kantons Bern",
      "url": "https://www.rrgr-service.apps.be.ch/api/rr/documents/document/aee15674d95b4e61b5affa25eefd4d69-332/9/2024.STA.698-RRB-DF-286698.pdf",
      "documentVersionDate": "2024-05-22",
      "reviewedOn": "2026-08-30",
      "reviewStatus": "verified"
    }
  ],
  "calendarProfiles": [
    {
      "calendarProfileId": "C_BE",
      "calendarId": "be-public-holidays",
      "holidayAnchor": "berneseProceduralLaw",
      "endShiftPolicy": "nextWorkingDay",
      "labels": {
        "de": "Bernische Samstage, Sonntage und anerkannte Feiertage",
        "fr": "Samedis, dimanches et jours fériés reconnus selon le droit bernois"
      }
    },
    {
      "calendarProfileId": "C_BGG",
      "calendarId": "be-public-holidays",
      "holidayAnchor": "partyOrRepresentativeCanton",
      "endShiftPolicy": "nextWorkingDay",
      "labels": {
        "de": "BGG-Kalender, im Kandidatenbestand mit Anknüpfung Kanton Bern",
        "fr": "Calendrier LTF, avec rattachement au canton de Berne dans les cas candidats"
      }
    },
    {
      "calendarProfileId": "C_FED_PROC",
      "calendarId": "be-public-holidays",
      "holidayAnchor": "partyOrRepresentativeCanton",
      "endShiftPolicy": "nextWorkingDay",
      "labels": {
        "de": "Bundesverfahrenskalender, Anknüpfung im konkreten Fall erforderlich",
        "fr": "Calendrier de procédure fédérale, rattachement à déterminer dans le cas concret"
      }
    },
    {
      "calendarProfileId": "C_FIXED_REVIEW",
      "calendarId": null,
      "holidayAnchor": "authorityConfiguration",
      "endShiftPolicy": "manualReview",
      "labels": {
        "de": "Strikter Wahltermin aus amtlicher Anordnung, keine stille Verschiebung",
        "fr": "Échéance électorale stricte selon l'acte officiel, sans report automatique"
      }
    }
  ],
  "suspensionProfiles": [
    {
      "suspensionProfileId": "S0_NONE",
      "mode": "none",
      "suspensionSetId": null,
      "labels": {
        "de": "Kein Fristenstillstand",
        "fr": "Pas de suspension des délais"
      },
      "sourceRefs": [
        {
          "sourceId": "SRC-VRPG-BE-20230801",
          "locator": "Art. 41 bis 44"
        },
        {
          "sourceId": "SRC-BGG-20260401",
          "locator": "Art. 46 Abs. 2 Bst. c"
        }
      ]
    },
    {
      "suspensionProfileId": "S_BGG",
      "mode": "useSet",
      "suspensionSetId": "ch-court-holidays-2026-2028",
      "labels": {
        "de": "Fristenstillstand nach BGG",
        "fr": "Suspension des délais selon la LTF"
      },
      "sourceRefs": [
        {
          "sourceId": "SRC-BGG-20260401",
          "locator": "Art. 46"
        }
      ]
    },
    {
      "suspensionProfileId": "S_ATSG",
      "mode": "useSet",
      "suspensionSetId": "ch-court-holidays-2026-2028",
      "labels": {
        "de": "Fristenstillstand nach ATSG",